{
  "schema": "curriculum-assessment/1",
  "meta": {
    "name": "Agentic Software Modernization",
    "version": "1.0-DE",
    "source": "https://github.com/feststelltaste/asm-glossary",
    "language": "de",
    "description": "Fokussierter Kompetenzrahmen zur agentengestützten Modernisierung von Legacy-Softwaresystemen. Konzentriert auf die Kernkompetenzen: was ein Agent ist, wie Kontext funktioniert, wie man Legacy-Code für Agenten analysiert, welche Transformationsmuster tragen, wie Änderungen abgesichert werden und wie agentische Arbeit kontrolliert wird. Das klassische Modernisierungsumfeld ist im separaten Curriculum „Grundlagen der Softwaremodernisierung\" abgedeckt."
  },
  "scale": [
    { "value": 1, "short": "Unbekannt", "full": "Noch nie gehört" },
    { "value": 2, "short": "Grundidee", "full": "Grundidee klar" },
    { "value": 3, "short": "Verstehe", "full": "Kann erklären" },
    { "value": 4, "short": "Anwenden", "full": "Kann anwenden" },
    { "value": 5, "short": "Lehren", "full": "Kann lehren" }
  ],
  "levels": [
    { "code": "R1", "label": "Anwenden können", "expected": 4, "description": "Autonom in realen Modernisierungssituationen anwenden, beurteilen und anpassen können" },
    { "code": "R2", "label": "Verstehen", "expected": 3, "description": "Zusammenhänge, Mechanik und Tradeoffs erklären können" },
    { "code": "R3", "label": "Kennen", "expected": 2, "description": "Begriffe und Konzepte benennen und einordnen können" }
  ],
  "lessons": [
    {
      "number": 1,
      "title": "Agent und agentischer Zyklus",
      "goals": [
        {
          "id": "LG 1-1",
          "level": "R2",
          "effortHours": 1.5,
          "title": "KI-Agent, agentischen Zyklus und Werkzeugnutzung erklären",
          "description": "Der gemeinsame Grundbegriff. Ohne saubere Abgrenzung vermischen sich Chatbot-Erwartungen mit Agenten-Realität, und jede Folgeaussage kippt.",
          "topics": [
            "LLM mit Tool-Zugriff vs. reiner Chatbot",
            "Zyklus: Planen, Handeln, Beobachten, Re-Planen",
            "Werkzeugnutzung als Wirkhebel und Risikoquelle",
            "Strukturierte Ausgabe als Brücke zu deterministischen Systemen"
          ],
          "example": "Agent bekommt „bring den Test zum Laufen\". Zyklus: (1) Read der Testdatei, (2) Beobachtung: Mock-Server auf Port 8080 erwartet, (3) Re-Plan: Mock starten, (4) Bash-Start, (5) Beobachtung: Port belegt. Ohne sauberen Zyklus wird an Schritt 3 halluziniert. Werkzeugnutzung macht den Unterschied — aber `git reset --hard` als Tool-Aufruf ist auch das, was ganze Feature-Branches killt."
        },
        {
          "id": "LG 1-2",
          "level": "R2",
          "effortHours": 1,
          "title": "Mehrschrittplanung gegen reaktives Verhalten abgrenzen",
          "description": "Ein Agent, der immer nur den nächsten Schritt sucht, verläuft sich. Einer, der einen Plan hält und ihn anpasst, nicht. Die explizite Planung ist das, was agentische Arbeit skalierbar macht.",
          "topics": [
            "Explizite Planung vs. impliziter Fortschritt",
            "Plan-Revision bei neuer Beobachtung",
            "Abbruch bei Zieldrift"
          ],
          "example": "Refactoring: God-Class in drei Module extrahieren. Ohne Plan landet der Agent nach drei Stunden in einem Halbzustand, alles kompiliert, aber Tests sind weg. Mit Plan (1. Nahtstellen, 2. Tests spannen, 3. extrahieren, 4. Tests wieder grün) bleibt jederzeit nachvollziehbar, wo man steht."
        },
        {
          "id": "LG 1-3",
          "level": "R1",
          "effortHours": 2,
          "title": "Agentischen Ansatz für eine Aufgabe begründet wählen oder ablehnen",
          "description": "Die Kernentscheidung. Agent ist nicht immer die Antwort. Ohne diese Urteilskraft wird jede Aufgabe zum Hammer-Nagel-Problem — und jede Modernisierung teurer als nötig.",
          "topics": [
            "Wann ein Linter, ein Script oder ein Codemod besser passt",
            "Wann ein Agent durch Urteilsvermögen oder Recherche vorne liegt",
            "Aufgabenzuschnitt für Agenten",
            "Rückbezug auf klassische Change-Strategien"
          ],
          "example": "Aufgabe A: 300 Dateien auf neuen Lombok-Namespace umschreiben — kein Agent, sondern `sed`. Aufgabe B: einen impliziten Domänen-Begriff in 40 Dateien identifizieren und vereinheitlichen — hier passt ein Agent. Aufgabe C: VB6-Monolith zu .NET migrieren — weder Agent noch Script, das ist eine Re-Architecting-Entscheidung."
        }
      ]
    },
    {
      "number": 2,
      "title": "Kontext und seine Pathologien",
      "goals": [
        {
          "id": "LG 2-1",
          "level": "R2",
          "effortHours": 2,
          "title": "Kontextfenster-Grenzen und die drei Pathologien beherrschen",
          "description": "Kontext ist endlich und kostet Qualität. Kontextverfall, -vergiftung und -verschmutzung sind drei verschiedene Fehlerbilder mit drei verschiedenen Gegenmaßnahmen — sie zu unterscheiden ist die Voraussetzung für alle weiteren Gegenmaßnahmen.",
          "topics": [
            "Kontextfenster als harte Grenze, Qualitätskurve davor",
            "Kontextverfall: schleichender Qualitätsverlust",
            "Kontextvergiftung: falsche oder widersprüchliche Inhalte",
            "Kontextverschmutzung: plausible, aber irrelevante Inhalte"
          ],
          "example": "Nach 80 Turns erfindet der Agent Code, der nur diskutiert, nie geschrieben wurde — Verfall. Veralteter Copy-Paste-Kommentar behauptet `deprecated since v2`, die Funktion ist längst rehabilitiert — Vergiftung. Drei irrelevante README-Auszüge im Kontext führen zu falschen Schlüssen über die aktuelle Datei — Verschmutzung. Drei Bilder, drei Fixes."
        },
        {
          "id": "LG 2-2",
          "level": "R2",
          "effortHours": 1.5,
          "title": "Halluzinationen durch Verankerung und Sitzungsaufteilung eindämmen",
          "description": "Die zwei pragmatischen Werkzeuge. Grounding an echten Artefakten statt plausibel klingender Behauptungen, und neue Sitzungen statt immer längerer Historie.",
          "topics": [
            "Verankerung an Dateien, Pfaden, stabilen Identifikatoren",
            "Kontextbereinigung und Sitzungsaufteilung",
            "Übergabeartefakte zwischen Sitzungen",
            "Halluzination als primäres Erkennungssignal — und wie sie sich von Kontextabweichung unterscheidet"
          ],
          "example": "Statt „refaktoriere den Zahlungsservice\" besser: „in `src/payments/service.ts` Methode `processPayment` auf Typ `PaymentRequest` statt `any` umbauen\". Pfad und Typname sind Anker. Langes Refactoring wird in 3 Sitzungen mit kurzer Übergabe besser als in einer 6-Stunden-Sitzung — weil Kontextverfall messbar wird, auch wenn er sich nicht anfühlt."
        },
        {
          "id": "LG 2-3",
          "level": "R1",
          "effortHours": 2,
          "title": "Kontextstrategie für konkrete Modernisierungsaufgabe entwerfen",
          "description": "Der Transfer. Was muss der Agent wissen, was nicht, in welcher Reihenfolge, und wann wird die Sitzung geschnitten.",
          "topics": [
            "Minimum Viable Context pro Teilaufgabe",
            "Reihenfolge und Schichtung der Kontextbausteine",
            "Grenzen der Sitzung",
            "Verzahnung mit Slicing aus Lektion 4"
          ],
          "example": "Extraktion eines Zahlungsmoduls. Kontextstrategie: Sitzung 1 nur Analyse (Graph, Nahtstellen, Tests). Sitzung 2 nur Test-Extraktion. Sitzung 3 nur Code-Extraktion. Sitzung 4 Cleanup. Jede startet frisch mit definierter Kontextauswahl, nicht mit der gesamten Historie."
        }
      ]
    },
    {
      "number": 3,
      "title": "Legacy-Code für Agenten verfügbar machen",
      "goals": [
        {
          "id": "LG 3-1",
          "level": "R2",
          "effortHours": 1.5,
          "title": "Wissensrepräsentation für Agenten aufbauen",
          "description": "Menschliches Code-Verständnis sitzt in Köpfen, Agenten brauchen Artefakte. Call-Graphen, statische Analyse und Software Analytics sind die Brücke — und gleichzeitig die Priorisierungshilfe dafür, wo der Agent überhaupt anfangen soll.",
          "topics": [
            "Code-Wissensgraph: Aufrufe, Imports, Abhängigkeiten",
            "Statische Analyse: Typen, Datenflüsse, Code Smells",
            "Software Analytics: Git-Hotspots, Change-Frequenz, Ownership",
            "Grenzen: Reflection, dynamische Konfiguration"
          ],
          "example": "Hotspot-Karte kombiniert SonarQube-Findings (340 Smells) mit `git log`-Heatmap (60 % aller Commits in einer Klasse). `OrderProcessor` taucht in beiden Metriken als Ausreißer auf. Klarer Startpunkt — keine Diskussion mehr, wo der Agent ansetzen soll. Call-Graph zeigt zusätzlich die indirekten Aufrufwege, die sonst unsichtbar blieben."
        },
        {
          "id": "LG 3-2",
          "level": "R2",
          "effortHours": 1,
          "title": "Quellcodekonditionierung als Investition vor der Agentenarbeit begreifen",
          "description": "Die Codebasis für Agenten vorbereiten, bevor man sie auf sie loslässt. Klingt nach Kosmetik, ist aber der größte Hebel für Ergebnisqualität.",
          "topics": [
            "Konsistente Benennung und semantische Anker",
            "Klare Modulgrenzen",
            "Minimale Dokumentation an der richtigen Stelle",
            "Onboarding-Artefakte (z.B. CLAUDE.md, AGENTS.md)"
          ],
          "example": "Vor der Agentenarbeit zwei Tage in Umbenennung investiert: `proc1` wird `calculateTax`, `helper2` wird `normalizeAddress`. Halbiert die Fehlerrate der nachfolgenden Agentenarbeit, weil semantische Anker jetzt stehen. Investition, die sich nach einer Woche zurückzahlt."
        },
        {
          "id": "LG 3-3",
          "level": "R1",
          "effortHours": 2,
          "title": "Analysestrategie für Legacy-Codebasis entwerfen",